{
  "$schema": "../../../docs/quest.schema.json",
  "version": 1,
  "id": "fela-maslo",
  "revision": 1,
  "npcId": "fela",
  "title": "Szyld w sklepiku",
  "description": "Fela czeka przed sklepikiem.",
  "requires": [],
  "dialogue": {
    "intro": [
      "Cześć! Jestem Fela. To mój mały sklepik.",
      "Pomóż mi ułożyć napis MASŁO. Wybierz sylaby w dobrej kolejności."
    ],
    "active": [
      "Ułóżmy napis MASŁO. Najpierw wybierz pierwszą sylabę, potem drugą."
    ],
    "completed": [
      "Napis jest już gotowy. Chcesz jeszcze raz ułożyć MASŁO?"
    ],
    "acceptLabel": "Ułożę napis",
    "replayLabel": "Poćwiczmy"
  },
  "exercise": {
    "id": "build-maslo",
    "type": "syllable-build",
    "prompt": "Ułóż słowo MASŁO.",
    "target": "MASŁO",
    "targetParts": [
      "MA",
      "SŁO"
    ],
    "choices": [
      "SŁO",
      "MA",
      "LA"
    ],
    "hint": "Najpierw MA, potem SŁO. Razem: MASŁO."
  },
  "feedback": {
    "retry": "Spróbuj zmienić kolejność sylab. Szukamy słowa MASŁO.",
    "success": "Tak, to MASŁO! Dziękuję za pomoc. To jabłko jest dla ciebie.",
    "practice": "Świetnie, znów mamy napis MASŁO! Miło było poćwiczyć."
  },
  "reward": {
    "itemId": "apple",
    "quantity": 1
  }
}
